video_id,title,description,channel_title,channel_id,published_at,country,region_code,views,likes,comments,fetched_at
diBO0gMuTXo,BTS (방탄소년단) 'Hooligan' Official MV,"BTS 5th Album 'ARIRANG'
🎧 https://bts.lnk.to/ARIRANG


Credits:
Director: Hannah Lux Davis

Production Company: London Alley
Executive Producers: Brandon Bonfiglio, Luga Podesta, Andrew Lerios
Executive Producer: Tony Choi of Compass Productions
Production Producer: Jiyeon Seong & Sumi Kim
Line Producer: Seonghee Kim

First Assistant Director: James Yoo
Second Assistant Director: Jasmine Kim

Location Manager: Sangcheol Shin

Director of Photography: EumKo

Post Supervisor: Iván Ovalle
Editor: Graham Patterson of Modern Post
Assistant Editor: Trevor Clifford

Colorist: Matt Osborne of Company 3

Visual Effects: Mathematic

Production Designer: Sooyeon Tae

Gaffer: Byeongjin Yang
Key Grip: Sangjoon Lee

Featured Model: Soojoo
Sword Dancer: Sohyun
Cast Wardrobe Stylist: Kihyun Kim
Cast Hair & Makeup: Kiwoong Baek

Director’s Rep: Tommy LaBuda
London Alley Creative Team: Zach Urban & Andrew Hague
Director’s Assistant: Molly Foy


[BIGHIT MUSIC]

""Hooligan"" Music Produced by El Guincho, Fakeguido, Jasper Harris
(Pablo Diaz Reixa, Michel Magne, Pablo Martinez Alborch, Marcus “MarcLo” Lomax, Xplicit, Jung Kook, Delacey, Jasper Harris, RM, j-hope, SUGA, Derrick Milano, Pdogg, Kirsten Allyssa Spencer)

Executive Producer: Seonjeong Shin, Nicole Kim
Chief Producer: “hitman” bang
Executive Creative Director: Boyoung Lee

Content Production: HaeYoon Jang, Semin Kim, Jimin Hong, Sungjoon Moon, Isu You, percent han

Style Directing: BOYEON HUR, GANi, LOWA, ILWOONG LIM, SOOHYUN CHO

Performance Directing: MINSEONG KIM, GIWON GOO, SEONGEUN YOON

A&R: Gia Lim, Daniella Kim, Yunjoo Park, Michelle Lee, Jiyoon Chung

Brand Experience & Design: Kyle Shin, HIGHENDIDOL, Anderson, TJ Kwak, Jongmin Kim, Irene Lee, SOOSOOCHO 

Creative Operations: Sabinne Cheon, Jonghyun Oh, Seungmin Lee

Management Lead: Jongwook Park

Artist Management: Subin Kim, Daeseong Jeong, Jaekeun Song, Seungbyeong Lee, Jusang Lee, Jaebum In, Hyunho Lee, Sanghyun Jin, Junhyeok Kim, Jaeuk Kim, Hanseong Lee

Media Management: Hobum Song, Taehyeong Kim, Jusung Ryu, Jooho Hur

Management Operations: Jaeyoung Han, Jihyeon Kim, Songhui Baek

Business Strategy & Planning: Youkyung Lee, Hyemi Choi, Seongjun Kim, Wooseong Yee

Marketing: Katherine Bang, MinGyeong Kim, Woosun Choi, JeongYeon Kwon, Yeongju Kim, Eunhye Kim, Sejoo Choi, Inhye Hwang

Artist Contents: JEONGIN JANG, JIYEON AN, DAMIN LEE, HEEJU NAM, EUNJI PARK, GYUYEON LEE, MINHYUNG LEE, JIHONG LEE, CHUNGKI LEE, HEEYEON LEE



BIGHIT MUSIC. Rights are reserved selectively in the video. Unauthorized reproduction is a violation of applicable laws. Manufactured by BIGHIT MUSIC, Seoul, Korea.


Connect with BTS:
https://ibighit.com/bts
https://x.com/bts_bighit
https://x.com/BTS_twt
http://www.facebook.com/bangtan.official
https://www.youtube.com/user/BANGTANTV
http://instagram.com/BTS.bighitofficial
https://www.tiktok.com/@bts_official_bighit
https://weverse.io/bts/highlight
https://www.weibo.com/BTSbighit

#BTS #방탄소년단 #BTS_ARIRANG #Hooligan",HYBE LABELS,UC3IZKseVpdzPSBaWxBxundA,2026-04-07T15:00:00Z,US,US,7177731,1771326,114819,2026-04-08T11:29:56.192033
OJ19I9q_hOQ,The Invite | Official Trailer HD | A24,"SUBSCRIBE: http://bit.ly/A24subscribe

From director Olivia Wilde and starring Seth Rogen, Olivia Wilde, Penélope Cruz and Edward Norton. THE INVITE – In theaters this July.

RELEASE DATE: July 2026
DIRECTOR: Olivia Wilde
CAST: Seth Rogen, Olivia Wilde, Penélope Cruz and Edward Norton

------

ABOUT A24:
The studio behind EVERYTHING EVERYWHERE ALL AT ONCE, UNCUT GEMS, MIDSOMMAR, MOONLIGHT, BEEF on Netflix, EUPHORIA on Max & more.

Coming Soon: MOTHER MARY, BACKROOMS, THE DEATH OF ROBIN HOOD & more

Subscribe to A24's NEWSLETTER:  http://bit.ly/A24signup
Sign up for A24 MEMBERSHIP: aaa24.com
Visit A24 WEBSITE: http://bit.ly/A24filmsdotcom
Like A24 on FACEBOOK: http://bit.ly/FBA24
Follow A24 on TWITTER: http://bit.ly/TweetA24
Follow A24 on INSTAGRAM: http://bit.ly/InstaA24",A24,UCuPivVjnfNo4mb3Oog_frZg,2026-04-07T13:00:00Z,US,US,686970,16990,874,2026-04-08T11:29:56.192033
V88ZcV23Rsg,Championship: UConn vs. Michigan,Michigan and UConn meet at Lucas Oil Stadium for the national title. The Wolverines seek the Big Ten's first championship since 2000 despite an injury to Yaxel Lendeborg. Dan Hurley's Huskies eye a third ring in four years after beating Illinois.,TBS,UCD9-oAYJYLAX5GAKCz_48SA,2026-04-07T16:16:05Z,US,US,0,0,0,2026-04-08T11:29:56.192033
KWoTyfPsqbE,Sabrina Carpenter - House Tour (Official Video),"Listen to ‘Man’s Best Friend’: https://sabrinacarpenter.lnk.to/MansBestFriend   

New collection available: https://sabrinacarpenter.lnk.to/HouseTour7in

Starring - Sabrina Carpenter, Margaret Qualley & Madelyn Cline

Directed by Sabrina Carpenter & Margaret Qualley

Creative Director - Sarah Carpenter
Production Company - Freenjoy
Founder / Producer - Nathan Scherrer
EP / Producer - Tara Sheree
Producers - Aiden Magarian, Janelle Lopez Genzink, Amy Davidson Lewis, Merce Jessor
Production Team - Giulia Di Stravola, Erica Pribble, Chris San Andres, Linda Nhem, Tanja Meyer, Eva Simpao, Aswada

Label - Jenny Gorotiza, Izzi Zegers
Management - Janelle Lopez Genzink, Amy Davidson Lewis, Merce Jessor, Dasha Johnson - Volara Management 

Photographer - Alfredo Flores

1st ADs - Daniel Bennaiem, Henry Minzes

Director of Photography - Chris Ripley
Additional Camera Department - Adam Hull, Jacob Perry, Connor Lambert, Sergius Tariq X Nafa, Jackson Davis, Justin Zaffiro, Will Hecht, Cogeian Embry, Guy McVicker, Gilbert Alvarado, Sean Dommett, Corey Kiefer, Derrick Rose, Marianna Vashchilenko

Production Designer - Miranda Lorenz
Additional Art Department - Arisha West, Hailee Jacobs, Tina Charad, Sebastian Ize, Mike Zephro, Bobby Stevens, Chris Jones, Piper Riley, Jorge Quintanilla, Caitlin Mavromates, Stephen Kelley, Kevin Alpuche, Dorian Carillo, David Saenz de Maturana, George Marsala, Michael Lopez, Arnold Carrasco, Ryan Grant, Omar Cabron, Yuri Bordas, Pete Foley, Kevin Berve

Styling - Jared Ellner
Tailor - Katie Casey
Makeup Department - Carolina Gonzalez, Diane Buzzetta, Jen Tioseco
Hair Department - Evanie Frausto, Janine Rath Thompson, Zachary Morad
Manicurist - Zola Ganzorigt
Choreographer - Jasmine “JB” Baddie

Gaffer - Mathias Peralta
Additional Electric Department - Luis “Koach” Collazo, Joe Escandell, Jake Kaster, Anderson Lau, Patrick Mattes, Kenny Tucker, Harper Thomas, Chandler Tango, Brent Keys, Todd Warn, Tyler Tango, Blake Farmer, Justin Usami, Marlon Obrien, Bob Shoemaker, Teddy Weisfuss, Nate Brown, Raul Cervantes, Jamey Dunford, Marshall Cooper, Cruz Jimenez, T.J. Signai, Alfie Rodriguez

Key Grip - Matt Planer
Additional Grip Department - Nate Giordano, Matthew Seesta, Axel Cubias, Cody Ingham, Daniel Kusenda, Jake Condon, Shaun Giordano, Natalie Giordano, Marcial Gonzalez, Bruce Drinnon, Gaither Narron, Isaiah Soto, Blake Danchik, Sean Blair, Erik Covarrubias, Jose Gonzalez

Stunts - Patrick Romano, Paul Lacovara, Guy Fernandez

Cast Vanities - Olivia Pruitt, Karla Garcia, Leah Garcia, Kyle Potter

Editor - Sofia Kerpan @ Modern Post
Colorist - Tal Baltuch
VFX - Zeke Faust, ForeignXChange
Sound Mix - Harbour Picture Company

Subscribe to Sabrina’s channel: https://bit.ly/SCYTsubscribe  
 
Follow Sabrina Carpenter: https://linktr.ee/sabrinacarpenter 
Instagram:  https://www.instagram.com/sabrinacarpenter  
Facebook:  https://www.facebook.com/sabrinacarpenter 
Twitter:  https://x.com/SabrinaAnnLynn 
TikTok:  https://www.tiktok.com/@sabrinacarpenter 

Follow Team Sabrina:
Instagram: https://www.instagram.com/teamsabrina 
Twitter: https://x.com/TeamSabrina 
TikTok: https://www.tiktok.com/@teamsabrina  

Lyrics:
Take your shoes off
Thank you for dinner baby
I had a really great time
I really loved the conversation
And that your car self drives
The pineapple air freshener
Is my favorite kind
Well this is me but
if you have time
Do you want the house tour?
I could take you to the first, second, third floor
And I promise none of this is a metaphor
I just want you to come inside
Baby what's mine is now yours
The couch is really comfy comfy
Got some Chips Ahoy
If you're hungry hungry
You don't need to love me, love me, love me
I'm just so proud of my design
(to dim the lights)
Do you want the house tour?
I could take you to the first, second, third floor
And I promise none of this is a metaphor
I just want you to come inside
But never enter through the back door
House tour
Yeah, I spent a little fortune on the waxed floors
We can be a little reckless cause it's insured
I'm pleasured to be your hot tour guide
Baby what's mine is now yours
(Oh baby if you come inside, if you come inside
I might let you uh)
My house is on pretty girl avenue
My house was especially built for you
Some say it's a place where your dreams come true
My house
Could be your house too!
So um
Are you coming in or what?

#SabrinaCarpenter #HouseTour #MansBestFriend 

Music video by Sabrina Carpenter performing House Tour.© 2026 Island Records, a division of UMG Recordings, Inc.",SabrinaCarpenterVEVO,UC4mYKePIas5YgGfYZ2J2OxQ,2026-04-06T15:00:06Z,US,US,6678451,539808,17723,2026-04-08T11:29:56.192033
PMd1at7OwiE,The Devil Wears Prada 2 | Final Trailer,"Watch the new trailer for The Devil Wears Prada 2 with original song “Runway” performed by Lady Gaga and Doechii. Get tickets now and experience the film only in theaters May 1: https://Fandango.com/TheDevilWearsPrada2

Almost 20 years after making their iconic turn as Miranda, Andy, Emily and Nigel—Meryl Streep, Anne Hathaway, Emily Blunt and Stanley Tucci return to the fashionable streets of New York City and the sleek offices of Runway Magazine in the eagerly awaited sequel to the 2006 phenomenon that defined a generation. 
 
The film reunites the original main cast with director David Frankel and writer Aline Brosh McKenna, and introduces an all-new runway of characters including Kenneth Branagh, Simone Ashley, Justin Theroux, Lucy Liu, Patrick Brammall, Caleb Hearon, Helen J. Shen, Pauline Chalamet, B.J. Novak and Conrad Ricamora. Tracie Thoms and Tibor Feldman also reprise their roles as “Lily” and “Irv” from the first film. 
 
“The Devil Wears Prada 2” is produced by Wendy Finerman, and executive produced by Michael Bederman, Karen Rosenfelt and Aline Brosh McKenna. The film debuts exclusively in theaters May 1.",20th Century Studios,UC2-BeLxzUBSs0uSrmzWhJuQ,2026-04-06T16:00:00Z,US,US,2687024,39871,1592,2026-04-08T11:29:56.192033
Sm19ulXos18,The Five,"Dana Perino, Greg Gutfeld and Jesse Watters and rotating liberal co-hosts Jessica Tarlov and Harold Ford Jr. discuss and debate the hot issues across the spectrum from politics to pop culture.",FOX News,UCqWYIzQLZFW4NFXPfWBLW1w,2026-04-08T04:23:06Z,US,US,0,0,0,2026-04-08T11:29:56.192033
ECc_9YAfNBY,BABY MEL & YOUNGBOY NEVER BROKE AGAIN - MAKE EM HATE  (OFFICIAL VIDEO),"INSTAGRAM - BABYMEL 
SHOTBY TREY HD & JOSEPH CNOTE",Baby Mel,UCrdyyCcJcFHaE4mbzXXfYIw,2026-04-07T16:00:06Z,US,US,85773,8171,377,2026-04-08T11:29:56.192033
jdHdAoE9qNs,Honest Trailers | Avatar: Fire and Ash,"Well paint me blue and call me Na’vi, it’s time for another one a them Avatar movies! Fire and Ash? More like tired and a$$. James Cameron get yourself out the ocean and go fix the Terminator franchise you old so and so.

Voice Narration: Jon Bailey the EPIC VOICE GUY (@epicvoiceguy on all socials)
Title Design: Robert Holtby
Written by: Spencer Gilbert and Lon Harris
Produced by: Spencer Gilbert
Edited by: Kevin Williamsen
Post-Production Manager: Emin Bassavand
Manager, Video Operations: Tiffany Tse
Post-Production Specialist: Rebecca Castaneda
VP Content: Max Dionne

#honesttrailers #entertainment #parody #trailer #avatar #jamescameron #navi",Screen Junkies,UCOpcACMWblDls9Z6GERVi1A,2026-04-07T17:01:03Z,US,US,191663,9295,887,2026-04-08T11:29:56.192033
58fAS-HuRis,The Lead With Jake Tapper,"Jake Tapper covers all the day's top stories around the country and the globe, from politics to money and sports to popular culture.",CNN,UCStfhR2V58QkCCyq_8dlk6g,2026-04-08T04:53:47Z,US,US,0,0,0,2026-04-08T11:29:56.192033
egJA_LbjH7M,Kehlani - Folded (Lyrics),"🎵 Best TikTok Viral Music: https://youtube.com/playlist?list=PLBbWAaEu3aidb5XY-CVhuOVK-53HyNPlV

⏬ Download / Stream: 
https://kehlani.lnk.to/FoldedID

⚡️ Kehlani:
https://www.instagram.com/kehlani
https://x.com/Kehlani
https://www.facebook.com/Kehlani

⚡️ Creative Chaos:
https://linktr.ee/creative.chaos
https://soundcloud.com/creativchaos
https://open.spotify.com/user/creativchaos
https://www.tiktok.com/@creative.chaos_
https://www.facebook.com/creatvchaos
https://x.com/crevtivechaos
https://www.instagram.com/creativ.chaos

☄️ Lyrics:

[Verse 1]
It's so silly of me to act like I don't need you bad
When all, all I can think about is us since I seen you last
I know I didn't have to walk away
All I had to do was ask for space
I'm telling you, ""be on your way""
When I told you to fall back

[Chorus]
So can you come pick up your clothes?
I have them folded
Meet me at the door while it's still open
I know it's getting cold out, but it's not frozen
So come pick up your clothes
I have them folded

[Post-Chorus]
I'll let your body decide if this is good enough for you
Already folding it for you
Already folding up for you
I'll let your body decide if this is good enough for you
Already folding it for you
Already folding up for you

[Verse 2]
No matter what you do to switch the story up, I know I made my mark
And I would still choose you through it all, that's the crazy part (Crazy part)
I don't need no morе empty promises, promise mе that you got it
I don't need roses, just need some flowers from my garden
Can't you go back to how you loved on me when you started?
I'll be here begging for ya, you should be giving me love
All damn day, 'til the day is done (Done)
So if you wanna go that way, I'll be waiting on

[Chorus]
For you to come pick up your clothes
I have them folded
Meet me at the door while it's still open
I know it's getting cold out, but it's not frozen
So come pick up your clothes
I have them folded
So come pick up your clothes
I have them folded
Meet me at my door while it's still open
I know it's getting cold out, but tell me that it's not frozen
So come pick up your clothes
I have them folded

[Post-Chorus]
I'll let your body decide if this is good enough for you
Already folding it for you
Already folding up for you
I'll let your body decide if this is good enough for you
Already folding it for you
Already folding up for you
I'll let your body decide if this is good enough for you
Already folding it for you
Already folding up for you
I'll let your body decide if this is good enough for you
Already folding it for you
Already folding up for you

🚫 If you want to use this music in your video you will need permission from the artist or label.

#Kehlani #Folded #CreativeChaos #Pop #PopMusic #Music #Vocals #Lyrics #LyricVideo #TopHits #Hits",Creative Chaos,UCAKAf5d5-O5t58gEjXhF3mg,2026-04-06T13:12:48Z,US,US,102477,277,5,2026-04-08T11:29:56.192033
XO43hYFRSbs,Rick and Morty | Season 9 Official Trailer | adult swim,"New season of Rick and Morty premieres May 24 at 11pm on Adult Swim.

Watch Adult Swim on HBO Max: http://bit.ly/3Gy0aXA
SUBSCRIBE: https://youtube.com/adultswim1?sub_confirmation=1

About Adult Swim:
Watch Adult Swim on HBO Max, www.adultswim.com or by downloading the Adult Swim app. Binge marathons or watch selected episodes of many of your favorite shows including Rick and Morty, SMILING FRIENDS, The Boondocks, Aqua Teen Hunger Force, and many more.

Connect with Adult Swim Online:
Download the APPS: http://www.adultswim.com/apps/
Visit Adult Swim WEBSITE: http://www.adultswim.com 
Like Adult Swim on FACEBOOK: https://facebook.com/adultswim
Follow Adult Swim on TWITTER: https://twitter.com/adultswim
Follow Adult Swim on INSTAGRAM: http://instagram.com/adultswim

Watch Adult Swim in your country:
United Kingdom: https://bit.ly/AS_GB
Republic of Ireland: https://bit.ly/AS_GB
USA: https://bit.ly/AS_US
France: https://bit.ly/AS_FRA
Germany: https://bit.ly/AS_GER
Italy: https://bit.ly/AS_IT
Central and Eastern Europe: https://bit.ly/AS_HBOMAX
Denmark: https://bit.ly/AS_HBOMAX
Finland: https://bit.ly/AS_HBOMAX
Hungary: https://bit.ly/AS_HBOMAX
Netherlands: https://bit.ly/AS_HBOMAX
Norway: https://bit.ly/AS_HBOMAX
Poland: https://bit.ly/AS_HBOMAX",Adult Swim,UCgPClNr5VSYC3syrDUIlzLw,2026-04-07T14:00:01Z,US,US,118403,7934,685,2026-04-08T11:29:56.192033
zVeFQHwW_10,LAUGHING INTO THE SKY | Approximately Up,"Bob, Wade, and I attempt to build flying machine in Approximately Up! Hilarity ensues. 
LISTEN TO DISTRACTIBLE ►► https://open.spotify.com/show/2X40qLyoj1wQ2qE5FVpA7x

Play the Game ► https://store.steampowered.com/app/3904850/Approximately_Up/

Edited By ► @radRYT 
Edited By ► @LixianTV 

Awesome Games Playlist ► https://www.youtube.com/playlist?list=PL3tRBEVW0hiDAf0LeFLFH8S83JWBjvtqE

Scary Games Playlist ► https://www.youtube.com/playlist?list=PL3tRBEVW0hiBSFOFhTC5wt75P2BES0rAo",Markiplier,UC7_YxT-KID8kRbqZo7MyscQ,2026-04-07T20:50:46Z,US,US,491160,34652,1531,2026-04-08T11:29:56.192033
upey49pbRsQ,Air Supply — Making Love Out of Nothing at All (Sub. Español),"🎙️ Artista | Air Supply
💿 Canción | Making Love Out of Nothing at All
📅 Fecha de Lanzamiento | 01/07/1983
📻 Géneros Musicales | Pop

✨ Acerca de la Canción:
“Making Love Out of Nothing at All” de Air Supply es una de las baladas más poderosas del soft rock de los 80, escrita por Jim Steinman. La canción juega con un contraste brillante: el narrador afirma saber hacer casi todo en la vida… excepto una cosa imposible de dominar — dejar a la persona que ama. Es una declaración emocional intensa donde el amor no nace de condiciones, sino “de la nada”, desde la pura conexión y entrega.

📲 Sígue a ""Air Supply"" en:
▶️ YouTube: https://www.youtube.com/channel/UCLIx3q_0KLVHAxgxsvh_vSQ

🪩 [ Letra / Lyrics ] 🪩

[Verse 1]
I know just how to whisper
And I know just how to cry
I know just where to find the answers
And I know just how to lie
I know just how to fake it
And I know just how to scheme
I know just when to face the truth
And then I know just when to dream
And I know just where to touch you
And I know just what to prove
I know when to pull you closer
And I know when to let you loose

[Verse 2]
And I know the night is fading
And I know the time's gonna fly
And I'm never gonna tell you everything I gotta tell you
But I know I gotta give it a try
And I know the roads to riches
And I know the ways to fame
I know all the rules and then I know how to break 'em
And I always know the name of the game

[Verse 3]
But I don't know how to leave you
And I'll never let you fall
And I don't know how you do it
Making love out of nothing at all

[Chorus]
(Making love) Out of nothing at all
(Making love) Out of nothing at all
(Making love)
Out of nothing at all
(Making love) Out of nothing at all
(Making love) Out of nothing at all
(Making love) Out of nothing at all

[Verse 4]
Every time I see you, all the rays of the sun
Are all streaming through the waves in your hair
And every star in the sky is taking aim at your eyes
Like a spotlight
The beating of my heart is a drum and it's lost
And it's looking for a rhythm like you
You can take the darkness from the pit of the night
And turn it to a beacon burning endlessly bright
I've gotta follow it 'cause everything I know
Well it's nothing 'til I give it to you

[Guitar Solo]

[Verse 5]
I can make the runner stumble
I can make the final block
And I can make every tackle at the sound of the whistle
I can make all the stadiums rock
I can make tonight forever
Or I can make it disappear by the dawn
And I can make you every promise that has ever been made
And I can make all your demons be gone

[Verse 6]
But I'm never gonna make it without you
Do you really wanna see me crawl
And I'm never gonna make it like you do
Making love out of nothing at all

[Chorus]
(Making love) Out of nothing at all
(Making love) Out of nothing at all
(Making love) Out of nothing at all
(Making love) Out of nothing at all
(Making love) Out of nothing at all
(Making love, love)
Out of nothing at all (Making love)
Out of nothing at all (Making love)
Out of nothing at all (Making love, love)
Out of nothing at all (Making love)
Out of nothing at all (Making love)
Out of nothing at all (Making love, love, love)
Out of nothing at all (Making love)
Out of nothing at all (Making love)
Out of nothing at all (Making love, love, love)
Out of nothing at all (Making love)
(Making love, love, love)
Out of nothing at all (Making love)
Out of nothing at all (Making love)
Out of nothing at all (Making love, love, love)
(Making love, love, love)
(Making love, love, love)

#AirSupply #MakingLoveOutOfNothingAtAll",RetroVerse,UCYseEz7wiBJr1S3QwC7Ntdw,2026-04-05T20:48:16Z,US,US,1528908,5855,29,2026-04-08T11:29:56.192033
NW2CRIFAVnk,Official Trailer | Rick and Morty Season 9 | Adult Swim Europe,"Season 9, baby. Rick and Morty returns May 25 on HBO Max across Europe

#adultswimeurope #adultswim #rickandmorty
-
Click the link to watch [adult swim] in your country: https://linktr.ee/adultswimworld

► SUBSCRIBE to Adult Swim Europe: http://bit.ly/1ntNOb5
 
Follow us here too, we’re fun.​
Instagram: https://www.instagram.com/adultswimeurope/   ​
TikTok: https://www.tiktok.com/@adultswimeurope  ​
Facebook: https://www.facebook.com/AdultSwimUKandEurope/    ​
X: https://x.com/AdultSwimUK  ​
 
We’re Adult Swim Europe, packed full of the best animation for adults. Serving up clips, full episodes, live streams and local content.​ Enjoy some of your favourite shows, including Rick and Morty, Smiling Friends, Common SIde Effects, My Adventures With Superman, Ninja Kamui, Lazarus, Samurai Jack, Gennedy Tartakovsky's Primal, Robot Chicken, Mr. Pickles, and more. Watch some playlists. Fast forward, rewind, pause. It's all here. We know you wouldn't forget, but it never hurts to make sure.",Adult Swim Europe,UCHcMtE3EiKmqrJZBZyUBuRQ,2026-04-07T14:02:00Z,US,US,422572,21721,1382,2026-04-08T11:29:56.192033
LV5K3-VQl64,Katy Tur Reports,"The latest breaking news, reporting and live coverage of the day's important stories; discussions with newsmakers, journalists and politicians.",MSNBC,UCPMoZoTUinLM-MngPHWijUw,2026-04-08T03:11:36Z,US,US,0,0,0,2026-04-08T11:29:56.192033
YqXmiZZVtD0,Oh girl - Tonton Malele (feat. Sean Rii),"Business Enquiries: maimaiincpg@gmail.com

Comment where you are listening to this from!
Drop a '🇵🇬 or 🇸🇧' if you represent Solomons or PNG!

📲 Connect and follow Tonton Malele ⬇️
https://www.facebook.com/clinton.malele.798
https://www.instagram.com/tonton_malele
https://www.tiktok.com/@tonton_malele

📲 Connect and follow Sean Rii ⬇️
https://www.facebook.com/seanriimusic
https://www.instagram.com/seanriiofficial/
https://www.tiktok.com/@r11sean

Distributed by ACTS Music Group
https://actsdistro.com
https://www.youtube.com/@actsmusicgroup",Tonton Malele,UCACfJmh_OB_IcVxtZQoGYKQ,2026-04-02T14:00:06Z,US,US,61075,2692,254,2026-04-08T11:29:56.192033
U1MqJBVn8Rk,Marvel Television’s Daredevil: Born Again Season 2 | Official Trailer,"All hell breaks loose. 
 
Stream Marvel Television's #DaredevilBornAgain Season 2 now, only on Disney+. And don't miss A Marvel Television Special Presentation: The Punisher: One Last Kill, streaming May 12 on Disney+.

► SUBSCRIBE to the channel to get notified when new Marvel videos are posted: https://www.youtube.com/marvel?sub_confirmation=1

► SUBSCRIBE to Disney+ to stream all of your favorite Marvel shows and movies: https://www.disneyplus.com/

Follow on social media to get the latest news and announcements from Marvel:

TikTok: https://www.tiktok.com/@marvel
Instagram: https://www.instagram.com/marvel
Facebook: https://www.facebook.com/Marvel
X: https://x.com/marvel

Experience more stories by subscribing: 

@Disney 
@StarWars 
@pixar 
@disneyplus",Marvel Entertainment,UCvC4D8onUfXzvjTOM-dBfEA,2026-04-06T19:00:01Z,US,US,2395186,49392,2109,2026-04-08T11:29:56.192033
5IS5FLUbpDo,DO NOT Play Super Battle Golf Like This,"This might be our worst idea yet!

Use code S7 on Gamer Supps for 10% OFF your order
Get my GamerSupps flavor, GOOD here!: https://gamersupps.gg/s7

Check out my other channels!
Solo Let's Play Channel: https://www.youtube.com/@SMii7Yplays
Stream Highlight Channel:  https://www.youtube.com/c/SMii7Yplus
Stream VODs:  https://www.youtube.com/c/SMii7Yminus

Follow my social medias and stream!
🔴 Stream  -  http://www.twitch.tv/smii7y
👕 Merch - https://smii7y.store/
🐦 Twitter  -  https://twitter.com/SMii7Y
📷 Instagram  -  https://www.instagram.com/smii7y/
🎬 Clips Page - https://www.instagram.com/smii7y.clips/

Friends in the video:
@Bigpuffer 
@ElasticDroid 
@Grizzy 
@BlargMyShnoople 

🎵 Music by:
http://www.epidemicsound.com/
https://www.shutterstock.com/
http://www.premiumbeat.com/
http://audiojungle.net/
https://www.soundsnap.com/
https://www.pond5.com/
https://motionarray.com/
incompetech.com 
Licensed under Creative Commons: By Attribution 3.0
http://creativecommons.org/licenses/by/3.0/
https://99sounds.org/

Edited by: https://www.youtube.com/@WiddasTy
Thumbnail Milkbag Character Artist: https://twitter.com/ArtzyYT
Intro Milkbag Character Artist: https://twitter.com/RoboEye5
Outro Music Created by:  https://www.youtube.com/@MattercellEntertainment",SMii7Y,UCzXwjTI6c6mVn6oui_p6oiw,2026-04-07T21:06:35Z,US,US,430523,33229,1299,2026-04-08T11:29:56.192033
